{
  "$schema": "http://json-schema.org/draft-07/schema#",
  "$id": "",
  "title": "Normalized Log",
  "description": "A normalized log",
  "type": "object",
  "properties": {
    "application_group_id": {
      "description": "Unique identifier for the tenant which owns the application being monitored (defined by Watson IT)",
      "type": "string"
    },
    "application_id": {
      "description": "Unique identifier of the application being monitored (defined by Watson IT)",
      "type": "string"
    },
    "level": {
      "description": "Severity level from 1-5",
      "type": "integer"
    },
    "type": {
      "description": "Log type (e.g. StandardLog)",
      "type": "string"
    },
    "message": {
      "description": "The log message",
      "type": "string"
    },
    "instance_id": {
      "description": "Name of the log's application or instance",
      "type": "string"
    },
    "timestamp": {
      "description": "Millisecond timestamp of the log",
      "type": "integer"
    },
    "utc_timestamp": {
      "description": "UTC timestamp of the log",
      "type": "string"
    },
    "features": {
      "description": "empty array for log features",
      "type": "array"
    },
    "meta_features": {
      "description": "Empty array for meta features, such as time window",
      "type": "array",
      "items": {
        "type": "object"
      }
    },
    "entities": {
      "description": "JSON object of log's entities (pod, container, etc.)",
      "type": "object"
    }
  },
  "required": ["application_group_id", "application_id", "message", "instance_id", "timestamp", "features", "meta_features", "entities"]
}
